{
  "id": "base:cheddar_small",
  "type": "product",
  "name": "loc:product.cheddar_small",
  "category": "chilled",
  "tags": [
    "chilled",
    "ingredient",
    "slicer"
  ],
  "storage": "chilled",
  "shelf_footprint": [
    1,
    1
  ],
  "units_per_case": 12,
  "base_cost": 3.64,
  "market_price": 0.0,
  "price_band": [
    0.0,
    0.0
  ],
  "shelf_life_days": 45,
  "licence": "base:general_retail",
  "suppliers": [
    "base:metro_wholesale"
  ],
  "urgency": "low"
}
