{
  "id": "base:butter_house",
  "type": "product",
  "name": "loc:product.butter_house",
  "category": "chilled",
  "tags": [
    "chilled",
    "ingredient"
  ],
  "storage": "chilled",
  "shelf_footprint": [
    1,
    1
  ],
  "units_per_case": 24,
  "base_cost": 1.89,
  "market_price": 0.0,
  "price_band": [
    0.0,
    0.0
  ],
  "shelf_life_days": 60,
  "licence": "base:general_retail",
  "suppliers": [
    "base:metro_wholesale"
  ],
  "urgency": "low"
}
