{
  "id": "base:collector_box",
  "type": "product",
  "name": "loc:product.collector_box",
  "category": "sealed_product",
  "tags": [
    "high_value",
    "sealed"
  ],
  "storage": "ambient",
  "shelf_footprint": [
    1,
    1
  ],
  "units_per_case": 6,
  "base_cost": 180.0,
  "market_price": 240.0,
  "price_band": [
    156.0,
    456.0
  ],
  "shelf_life_days": 0,
  "licence": "base:sealed_distribution",
  "suppliers": [
    "base:metro_wholesale"
  ],
  "urgency": "low"
}
