{
  "id": "base:sourdough_seasonal",
  "type": "product",
  "name": "loc:product.sourdough_seasonal",
  "category": "bakery",
  "tags": [
    "ingredient",
    "perishable"
  ],
  "storage": "ambient",
  "shelf_footprint": [
    1,
    1
  ],
  "units_per_case": 6,
  "base_cost": 1.84,
  "market_price": 4.6,
  "price_band": [
    2.99,
    8.74
  ],
  "shelf_life_days": 3,
  "licence": "base:general_retail",
  "suppliers": [
    "base:metro_wholesale"
  ],
  "urgency": "low"
}
