{
  "id": "base:raw_single_large",
  "type": "product",
  "name": "loc:product.raw_single_large",
  "category": "singles",
  "tags": [
    "buylist_tracked",
    "case_only"
  ],
  "storage": "ambient",
  "shelf_footprint": [
    2,
    1
  ],
  "units_per_case": 48,
  "base_cost": 18.0,
  "market_price": 42.0,
  "price_band": [
    27.3,
    79.8
  ],
  "shelf_life_days": 0,
  "licence": "base:secondhand_dealer",
  "suppliers": [
    "base:metro_wholesale"
  ],
  "urgency": "low"
}
