{
  "id": "base:chips_small",
  "type": "product",
  "name": "loc:product.chips_small",
  "category": "confectionery",
  "tags": [
    "impulse",
    "snack"
  ],
  "storage": "ambient",
  "shelf_footprint": [
    1,
    1
  ],
  "units_per_case": 8,
  "base_cost": 0.35,
  "market_price": 1.26,
  "price_band": [
    0.82,
    2.39
  ],
  "shelf_life_days": 120,
  "licence": "base:general_retail",
  "suppliers": [
    "base:metro_wholesale"
  ],
  "urgency": "high"
}
