{
  "id": "base:red_wine_large",
  "type": "product",
  "name": "loc:product.red_wine_large",
  "category": "alcohol",
  "tags": [
    "age_restricted"
  ],
  "storage": "ambient",
  "shelf_footprint": [
    2,
    1
  ],
  "units_per_case": 24,
  "base_cost": 9.75,
  "market_price": 36.0,
  "price_band": [
    23.4,
    68.4
  ],
  "shelf_life_days": 900,
  "licence": "base:on_premise_alcohol",
  "suppliers": [
    "base:metro_wholesale"
  ],
  "urgency": "low"
}
