{
  "id": "base:toploaders_house",
  "type": "product",
  "name": "loc:product.toploaders_house",
  "category": "accessories",
  "tags": [
    "counter_adjacent"
  ],
  "storage": "ambient",
  "shelf_footprint": [
    1,
    1
  ],
  "units_per_case": 8,
  "base_cost": 1.98,
  "market_price": 5.4,
  "price_band": [
    3.51,
    10.26
  ],
  "shelf_life_days": 0,
  "licence": "base:general_retail",
  "suppliers": [
    "base:metro_wholesale"
  ],
  "urgency": "low"
}
